{
  "schema": "szk.ma.convert-result/v1",
  "kind": "ci_to_se",
  "engine_version": "0.2.0",
  "outputs": {
    "se": 0.2033
  },
  "estimated": false,
  "method": {
    "id": "ci_to_se",
    "citation": "Cochrane Handbook 6.3.1",
    "function": "conversions.se_from_ci",
    "kb_refs": []
  },
  "assumptions": [
    "normális közelítés (z = 1,96)"
  ],
  "warnings": []
}
